{
  "caseId": "question-as-useful-direction",
  "pass": true,
  "requiredSignals": [
    {
      "signal": "question-acknowledged:legacy-fallback",
      "observed": true,
      "evidence": "The response explicitly says, “Good question,” and addresses it by explaining that the document provided no supported reason for retaining the fallback."
    }
  ],
  "forbiddenSignals": [
    {
      "signal": "question-silently-converted-to-edit:legacy-fallback",
      "observed": false,
      "evidence": "The edit was not silent: the response explicitly acknowledged the question and explained why the document was revised to mark the rationale and removal conditions as undocumented."
    }
  ],
  "summary": "The response explicitly acknowledges and substantively addresses the legacy-fallback question, so the required signal is present and the forbidden silent-conversion signal is absent."
}
