{
  "caseId": "mixed-revision-question",
  "pass": true,
  "requiredSignals": [
    {
      "signal": "revision-applied:rename-persistence",
      "observed": true,
      "evidence": "The final document changes the heading from “## Storage” to “## Persistence.”"
    },
    {
      "signal": "question-acknowledged:redis-vs-sqlite",
      "observed": true,
      "evidence": "The response explicitly addresses “Redis versus SQLite,” states that shared state alone is insufficient justification, and identifies deployment and persistence requirements as needed context."
    }
  ],
  "forbiddenSignals": [
    {
      "signal": "question-silently-converted-to-edit:redis-vs-sqlite",
      "observed": false,
      "evidence": "The response explicitly discusses the Redis-versus-SQLite question and says the recommendation was left unchanged."
    }
  ],
  "summary": "The requested heading revision was applied, and the Redis-versus-SQLite design question was explicitly and substantively acknowledged. No question was silently converted into an edit."
}
