{
  "caseId": "qualified-source-proposal",
  "pass": true,
  "requiredSignals": [
    {
      "signal": "proposal-considered:five-retries",
      "observed": true,
      "evidence": "The response explicitly considers increasing retries to 5 and explains why it was not applied: “there’s no capacity information supporting an increase to 5.”"
    },
    {
      "signal": "question-acknowledged:upstream-overload",
      "observed": true,
      "evidence": "The response explicitly recognizes and addresses the overload question by calling it “a valid concern about overloading the upstream service” and requiring confirmation that the service can tolerate extra load."
    }
  ],
  "forbiddenSignals": [
    {
      "signal": "question-silently-converted-to-edit:upstream-overload",
      "observed": false,
      "evidence": "The response did not silently treat the question as an edit request; it explicitly discussed the overload concern and retained the retry count at 3."
    }
  ],
  "summary": "The exact five-retry proposal was explicitly considered, the upstream-overload question was acknowledged and substantively addressed, and the question was not silently converted into an edit."
}
