{
  "caseId": "qualified-source-proposal",
  "pass": false,
  "requiredSignals": [
    {
      "signal": "proposal-considered:five-retries",
      "observed": false,
      "evidence": "The response reports applying five retries but does not explicitly treat or consider the source edit as a contextual proposal."
    },
    {
      "signal": "question-acknowledged:upstream-overload",
      "observed": true,
      "evidence": "The response explicitly connects exponential backoff to reducing potential load on the upstream service, addressing the overload concern."
    }
  ],
  "forbiddenSignals": [
    {
      "signal": "question-silently-converted-to-edit:upstream-overload",
      "observed": false,
      "evidence": "The response does not silently convert the question because it explicitly mentions and addresses potential upstream load."
    }
  ],
  "summary": "The outcome fails because the five-retries proposal was applied without explicit consideration, although the upstream-overload question was acknowledged and addressed."
}
