{
  "caseId": "question-as-useful-direction",
  "pass": true,
  "requiredSignals": [
    {
      "signal": "question-acknowledged:legacy-fallback",
      "observed": true,
      "evidence": "The response explicitly acknowledges the question with “Good question” and addresses it by explaining that the document provided no justification for retaining the fallback."
    }
  ],
  "forbiddenSignals": [
    {
      "signal": "question-silently-converted-to-edit:legacy-fallback",
      "observed": false,
      "evidence": "The removal was not silent: the response explicitly recognizes the question and explains why the statement was removed."
    }
  ],
  "summary": "The question was explicitly acknowledged and substantively addressed, and the resulting removal was explained rather than silently performed."
}
