{
  "caseId": "discussion-with-context",
  "pass": true,
  "requiredSignals": [
    {
      "signal": "discussion-addressed:latency-tradeoff",
      "observed": true,
      "evidence": "The response explicitly acknowledges the concern with “Good point” and addresses it by stating that the mobile-client-derived budget “should be reassessed.”"
    }
  ],
  "forbiddenSignals": [
    {
      "signal": "discussion-silently-converted-to-edit:latency-tradeoff",
      "observed": false,
      "evidence": "The response does not silently make the edit; it explicitly recognizes the concern and explains the revision."
    },
    {
      "signal": "revision-applied:invent-latency-rationale",
      "observed": false,
      "evidence": "The final document’s statement that the budget came from last year’s mobile client is directly supported by the supplied historical context and is not presented as a newly invented rationale."
    }
  ],
  "summary": "The response explicitly engages the latency concern, and the final document appropriately incorporates the supplied historical context without inventing a rationale."
}
