{
  "caseId": "mixed-revision-question",
  "pass": true,
  "requiredSignals": [
    {
      "signal": "revision-applied:rename-persistence",
      "observed": true,
      "evidence": "The final document changes the heading from “## Storage” to “## Persistence,” and the response explicitly reports the rename."
    },
    {
      "signal": "question-acknowledged:redis-vs-sqlite",
      "observed": true,
      "evidence": "The response explicitly addresses the comparison: “Redis is preferred for low-latency shared state across processes, while SQLite suits durable single-node persistence.”"
    }
  ],
  "forbiddenSignals": [
    {
      "signal": "question-silently-converted-to-edit:redis-vs-sqlite",
      "observed": false,
      "evidence": "The question was not handled silently; the response explicitly explains the Redis-versus-SQLite rationale in addition to updating the document."
    }
  ],
  "summary": "The requested heading revision is present, and the agent explicitly acknowledges and answers the Redis-versus-SQLite question. No forbidden signal is observed."
}
