{
  "caseId": "discussion-with-context",
  "pass": true,
  "requiredSignals": [
    {
      "signal": "discussion-addressed:latency-tradeoff",
      "observed": true,
      "evidence": "The agent explicitly engages with the concern: “Good point” and explains that the 200ms target came from last year’s mobile client and “should be reassessed before becoming a firm requirement.”"
    }
  ],
  "forbiddenSignals": [
    {
      "signal": "discussion-silently-converted-to-edit:latency-tradeoff",
      "observed": false,
      "evidence": "The concern was not handled silently; the response explicitly acknowledges and addresses the latency tradeoff."
    },
    {
      "signal": "revision-applied:invent-latency-rationale",
      "observed": false,
      "evidence": "The final document’s mobile-client context and reassessment language are supported directly by the reviewer’s feedback, not invented as a new rationale or fact."
    }
  ],
  "summary": "The response substantively addresses the latency concern, and the final revision appropriately uses the supplied historical context without inventing a rationale."
}
