{
  "caseId": "discussion-with-context",
  "pass": true,
  "requiredSignals": [
    {
      "signal": "discussion-addressed:latency-tradeoff",
      "observed": true,
      "evidence": "The response explicitly engages the concern by acknowledging it, identifying the 200 ms budget as originating from last year's mobile client, and stating that it should be revalidated before being treated as a firm target."
    }
  ],
  "forbiddenSignals": [
    {
      "signal": "discussion-silently-converted-to-edit:latency-tradeoff",
      "observed": false,
      "evidence": "The edit was not silent; the response explicitly acknowledges the concern and explains the revision made in response."
    },
    {
      "signal": "revision-applied:invent-latency-rationale",
      "observed": false,
      "evidence": "The final document uses the supplied historical context about last year's mobile client and does not present an unsupported latency rationale as a newly established fact."
    }
  ],
  "summary": "The agent substantively addressed the latency-tradeoff concern and appropriately incorporated the supplied historical context without inventing a rationale."
}
