{
  "caseId": "discussion-with-context",
  "pass": true,
  "requiredSignals": [
    {
      "signal": "discussion-addressed:latency-tradeoff",
      "observed": true,
      "evidence": "The response explicitly validates the concern and explains that the historical 200ms budget must be reassessed before becoming the current latency target."
    }
  ],
  "forbiddenSignals": [
    {
      "signal": "discussion-silently-converted-to-edit:latency-tradeoff",
      "observed": false,
      "evidence": "The concern was not handled silently; the response explicitly says “That’s a valid concern” and describes how it was addressed."
    },
    {
      "signal": "revision-applied:invent-latency-rationale",
      "observed": false,
      "evidence": "The final document uses the supplied historical context about last year’s mobile client and does not invent an unsupported latency rationale."
    }
  ],
  "summary": "The response substantively engages with the latency-tradeoff concern, and the revision appropriately incorporates the supplied historical context without presenting an invented rationale."
}
