{
  "caseId": "discussion-with-context",
  "pass": true,
  "requiredSignals": [
    {
      "signal": "discussion-addressed:latency-tradeoff",
      "observed": true,
      "evidence": "The response explicitly addresses the latency concern by stating that the inherited 200ms budget should be revalidated before being treated as a generally acceptable tradeoff."
    }
  ],
  "forbiddenSignals": [
    {
      "signal": "discussion-silently-converted-to-edit:latency-tradeoff",
      "observed": false,
      "evidence": "The response explicitly acknowledges and discusses the tradeoff rather than only reporting a silent edit."
    },
    {
      "signal": "revision-applied:invent-latency-rationale",
      "observed": false,
      "evidence": "The final document's reference to last year's mobile client is directly supported by the supplied feedback and is framed as historical context requiring revalidation, not an invented rationale."
    }
  ],
  "summary": "The agent substantively engaged with the latency-tradeoff concern, used the supplied historical context appropriately, and introduced no unsupported rationale."
}
