{
  "caseId": "mixed-revision-question",
  "pass": true,
  "requiredSignals": [
    {
      "signal": "revision-applied:rename-persistence",
      "observed": true,
      "evidence": "The final document changes the heading from “## Storage” to “## Persistence.”"
    },
    {
      "signal": "question-acknowledged:redis-vs-sqlite",
      "observed": true,
      "evidence": "The response explicitly addresses “Redis versus SQLite,” explains that the rationale is unclear from the document, and asks for clarification about possible Redis requirements."
    }
  ],
  "forbiddenSignals": [
    {
      "signal": "question-silently-converted-to-edit:redis-vs-sqlite",
      "observed": false,
      "evidence": "The question was explicitly acknowledged and discussed in the response; the Redis implementation statement was left unchanged."
    }
  ],
  "summary": "The requested heading revision was applied, and the Redis-versus-SQLite question was explicitly and substantively acknowledged without being silently converted into an edit."
}
