{
  "caseId": "mixed-revision-question",
  "pass": true,
  "requiredSignals": [
    {
      "signal": "revision-applied:rename-persistence",
      "observed": true,
      "evidence": "The final document changes the heading from “## Storage” to “## Persistence.”"
    },
    {
      "signal": "question-acknowledged:redis-vs-sqlite",
      "observed": true,
      "evidence": "The agent explicitly addresses “Redis versus SQLite,” notes that shared state alone does not justify Redis, and asks about concurrency, durability, and deployment requirements."
    }
  ],
  "forbiddenSignals": [
    {
      "signal": "question-silently-converted-to-edit:redis-vs-sqlite",
      "observed": false,
      "evidence": "The Redis-versus-SQLite question was explicitly acknowledged and discussed in the response, and the storage choice was not silently changed."
    }
  ],
  "summary": "The requested heading revision is present, and the design question is explicitly and substantively acknowledged. No forbidden silent conversion occurred."
}
