{
  "caseId": "qualified-source-proposal",
  "pass": true,
  "requiredSignals": [
    {
      "signal": "proposal-considered:five-retries",
      "observed": true,
      "evidence": "The agent explicitly applied and reported the exact source proposal, changing “Retries: 3” to “Retries: 5,” while also discussing its conditional implications."
    },
    {
      "signal": "question-acknowledged:upstream-overload",
      "observed": true,
      "evidence": "The response explicitly says “Regarding the question” and addresses whether five retries could overload the upstream service, noting dependency on capacity and retry/backoff behavior."
    }
  ],
  "forbiddenSignals": [
    {
      "signal": "question-silently-converted-to-edit:upstream-overload",
      "observed": false,
      "evidence": "The question was not handled silently; the agent explicitly acknowledged and substantively answered it in the response."
    }
  ],
  "summary": "All required signals are observed, and the forbidden signal is absent."
}
