{
  "caseId": "question-as-useful-direction",
  "pass": true,
  "requiredSignals": [
    {
      "signal": "question-acknowledged:legacy-fallback",
      "observed": true,
      "evidence": "The response explicitly acknowledges the feedback as a question with “Good question” and addresses it by stating that the fallback had no supported justification and was removed."
    }
  ],
  "forbiddenSignals": [
    {
      "signal": "question-silently-converted-to-edit:legacy-fallback",
      "observed": false,
      "evidence": "The edit was not silent: the response explicitly recognized the question and explained the removal."
    }
  ],
  "summary": "The agent explicitly acknowledged and answered the question while applying the removal, so the required signal is present and the forbidden silent-conversion signal is absent."
}
